headline,link,date,content
AI in HR has more obstacles for adoption since dealing with humans: Oracle’s Nagaraj Nadendla,https://economictimes.indiatimes.com/small-biz/security-tech/technology/ai-in-hr-has-more-obstacles-for-adoption-since-dealing-with-humans-oracles-nagaraj-nadendla/articleshow/113847640.cms,01-10-2024,"With technology and AI permeating every aspect of business, its impact on the function that deals with humans in an organisation perhaps needs a deeper look. In a chat with ET Digital on the sidelines of the
Oracle
CloudWorld in Las Vegas,
Nagaraj Nadendla
,
SVP
,
Product Development
at Oracle, talks about the emergence of AI in the field of HR, its use cases, utility and the looming prospects of job losses. Edited excerpts:
Economic Times (ET): It has been a crazy job market of late. We have seen the highs and then we have seen the lows, with job losses. People are fearful because they do not really know what to expect. Now you are throwing AI into the mix. What does it do? How does it play out?
Nagaraj Nadendla (NN):
If you look back at history, automation has come in many flavours. For example, rules-based automation has been there for a long time. There is workflow automation, where, for example, you are making an offer to a candidate and it goes beyond a certain threshold, you then need to take additional approvals. Then, machine learning came along that included aspects like suggestions, recommendations, predictions, etc. Now, AI is pushing the envelope.
If you take the auto industry, everything was handcrafted. But, guess what? In the early 20th century, the assembly line came along. From thousands of cars to 10,000s to 100,000s to millions of cars could be produced. Robots came along in the mid-20th century, but it did not displace workers. It improved productivity. Economic activity expanded. You take the case of any industry — construction, hospitality, etc — automation has enhanced productivity overall. That does not mean you do not need to reskill. Reskilling is a fact of life. So that is why organisations are thinking about being skills driven. This is the new currency.
What skills do I have and not have? What can I develop? What should I acquire externally? What should I borrow? These are all important questions companies should consider now.
It is an important mindset to have for organisations to be agile, nimble and prepare for the future. I am not predicting there would not be any job losses, but it should not be about job losses. It is redefining jobs in many ways and that has happened historically.
Live Events
Nagaraj Nadendla, SVP, Product Development at Oracle
ET: More services now offer options to screen job applicants using artificial intelligence, but there’s a risk of bias. How can we prevent this?
NN:
It is always possible. And I directly participate in managing recruiting functions within the product division. But, if you take a step back, humans are the most biased. There is no machine that can beat humans. So, if you start from there, it only gets better. But it has to be defensible. We get that.
Customers use a variety of tools, including ours, to determine job descriptions. Are the screening processes biased? So, in many high-volume industries, there is something called IO psychology-based assessments. They will give you a questionnaire and will then determine propensity for attrition and how long a candidate would stay, for example, in a call centre or in a retail job. So, there is a body of defensible IO psychology-based assessments that are time-tested.
Today, if you take technology jobs, many candidates are getting screened for technical skills. There is no bias there. Either you have them or you do not. There might be some grey area here and there, but the tools are evaluating. Increasingly, I think, if you start thinking about skills, people will get tested for every skill, one way or the other. It is almost like a background check. At the time you make an offer, the last step is, I give you the offer, but it is all pending on the background check. Like, is there a criminal record history? This is a sort of KYC.
Ultimately, customers are the arbiter. We are not. We focus on how we enable and help them with ensuring the accuracy of generative AI or classic AI. If you match a candidate, why is there a match? Ultimately, customers make the choice. So, there is bias, but human bias is worse than any other bias, right?
If you take the entire hiring or promotion procedure, there is nothing that prevents customers from cordoning off parts of the process where no AI tool will play a part. You can have agents or AI agents or others to provide you feedback. But how you process it and what you do with it could still be a human being. Assuming they are not biased.
ET: Let me extend that question a bit. Are you also suggesting that there should be certain functions where probably AI only does a part of the work? For example, you are sifting through thousands of CVs. The AI only looks at the skill set part of it and not the other aspects of the CV like gender or ethnicity?
NN:
That is a possible way, and these capabilities already exist. As far as I know, nobody feeds in gender, ethnicity, and other bits of protected information.
It can be about what schools you went to, but even there you can have a potential for bias. If you went to IIT versus NIIT versus Harvard, there could be a difference.
However, I want to go back to the first part of the question. As the dust settles on AI capabilities, eventually I see the cost-benefit analysis might end up being wherever there is a significant amount of work that a machine can do faster — excluding maybe some elements of human evaluation — AI will get entrenched. If I was to predict, if I was a betting man, that is what I would do.
In my domain, you take India as an example — or the Middle East or even parts of APAC and J-PAC and Latin America — you will see a lot of high-volume hiring happening. So, you need to schedule candidates for interviews at scale. Now, imagine if each candidate had a digital twin, an agent, and my agent is talking to all the digital twins to coordinate, to negotiate, on an interview slot, it would be of great value.
It is those things that become a lot more amenable to AI, driving much more positive outcomes. Minimal delays, better negotiation, or faster negotiation, getting to outcomes.
ET: Let us look at the skill to operate. If you look at a person who handles the accounts in a typical
SMB
, he must have honed his skills by working on an ERP system, which may be Oracle. Now, technology companies are launching new AI tools. So, what does it do to the demands of the skill set for the accounts executive? Also, the primary question that most SMBs ask is that, is the return going to be in commensurate with the kind of effort and the cost that we have to incur?
NN:
Regardless of the size, at some point if you decide to make a change or transform, be more skills driven or at least take parts of your back office or whatever office functions and look at introducing technology, or any automation technology, there are implications to development of the talent. So, it ultimately goes back to what I am willing to do. If I bring in technology, it is going to drive certain business outcomes, but it also has workforce implications. Am I willing to upskill, reskill or expand the skill sets, or am I looking externally? I think these are all decisions organisations have to make. Again, if I was to prognosticate, maybe SMBs will look at acquiring the skills and not invest in the development of the skills within the organisation, versus larger organisations where they have significantly more investments in learning and development, reskilling and upskilling.
ET: If you look at various functions, like finance, marketing and supply chain, is HR perhaps the most difficult part when it comes to technology adoption and AI, as it is dealing with a lot of people, emotions, etc?
NN:
There are, certainly, more obstacles for adoption in HR I would say, more so than in other areas, only because you are dealing with humans, and issues like data privacy and other laws. If you think about data privacy specifically, it started with North America and then the EU. Now every country has their own data privacy laws. And it did not stop there. If you think about AI, even within the US, New York has a state law.
If you look at Europe, there are worker councils and you cannot do certain things with talent without going through the councils. So, inherently, there are breaks put in by governments and even self-governance by organisations to ensure people are appropriately accounted for. But I think, again, history has shown technology has permeated processes in many ways.
The author was in Las Vegas on an invitation from Oracle."
"Bots and beyond: From financial crime to lending, AI can change world of money and finance, says Oracle’s Sonny Singh",https://economictimes.indiatimes.com/small-biz/security-tech/technology/bots-and-beyond-from-financial-crime-to-lending-ai-can-change-world-of-money-and-finance-says-oracles-sonny-singh/articleshow/113729265.cms,27-09-2024,"Sonny Singh, Executive Vice President & General Manager,
Oracle Financial Services
, has a granular view of what his customers want and how the sector is evolving. From large banks to fintechs, Singh has been intricately involved in rolling out technology solutions for each of them. While some look at technology in the financial space as a threat, some look at it as an opportunity. But with the emergence of AI, Singh says everyone, from lenders to borrowers, can expect big changes.
In a chat with ET Digital on the sidelines of
Oracle
CloudWorld at Las Vegas, Singh talks about the profound impact of technology on financial services, the likely impact of AI, concerns around job losses and how his clients and regulators are adjusting to new realities. Edited excerpts.
Economic Times (ET): It is easy to overestimate the impact of technology and at the same time it is also easy to underestimate the power of technology. What will be the real long-term impact in the financial services sector?
Sonny Singh (SS):
Thereare only three physical products that exist in financial services today — the debit card, credit card and a cheque book. Everything else is technology. So, there is an interesting statement that I have heard multiple times working in this industry that a bank essentially is just a technology company with a banking licence. So, if you really think about the business of banking, whether you are in the capital market space or in the corporate banking space or in retail banking, banking is essentially technology.
So, I would say that you can scarcely underestimate the importance of technology in banking. Banks are just a series of bits and bytes moving across. India is a great example of digital payments; but globally, more and more transactions are now moving to a digital format and there will be fewer and fewer physical payments.
Live Events
There will be physical payments. But if you compare pre-Covid payments to post-Covid payments, digital customers who only did digital transactions went up three times during Covid, understandably, and transactions went up six times.
So, as banks emerged from Covid, technology became even more important for them because more and more of their transactions were moving to a digital format and that is accelerating. Now, we have things like instant payments where you have very fast settlements. So, that is just talking about technology.
Now, you look at the next evolution of technology, which is AI. AI is going to be a transformational force as far as banking and financial services are concerned. There will be regulatory oversight on it because the models that are used have to be transparent and they have to be observable and scrutinised. But if anybody believes that AI is not going to be critical for the operations of financial institutions in the future, they are in for a surprise.
ET: So, on the topic of AI, the foremost area of concern is what it will do for jobs. What is your view?
SS:
This is my 35th year in technology and every wave of technology always seems to create a disruption where people think jobs are going to go away. I think a certain class of jobs will go away and a new class of jobs will come about. There is a very famous term called Luddites and when the steam engine was invented, people really thought that was the end of the world. We have survived 200 years after that; the population has grown by 3x since then and we still have a lot of jobs.
I think we do not know what we do not know. And the way jobs will evolve over the coming years, they will take advantage of all these things. So, maybe if I am used to doing something today, I may not be able to do exactly that job 5-7 years, 10 years from now, but I will be able to do something that creates value for my enterprise — whether it is in acquiring customers, whether it is introducing new products, whether it is in fulfilment operations, I will do something valuable for the enterprise. It will be powered differently. I will have different tools at my disposal. The type of value I create might be different from the type of value I create today. But I think if that is the only concern, that would not be a problem, because we will reinvent industries as we go along, as we have over the last 100 years.
ET: We have talked about the people who work in the sector, so let us park that aside. Now, let us look at borrowers and lenders. What is technology and AI going to do for borrowers and what is it going to do for lenders?
SS:
These models are evolving and they are increasing in the pace of their evolution. But let us talk about the lenders and individual consumers first. From a lender’s perspective, the idea is to really offer products that are tailored to a particular individual, that are focused on the appropriate life moments that they have. So, right now, banks have all these disparate systems, where the loan systems and the deposit systems and the wealth systems and all of that are completely siloed. They do not even have a single view of the customer and they cannot bring a unified view of the customer experience. So, the first thing that will happen is it will allow banks to more effectively participate in the financial well-being of their customers.
Sonny Singh, Executive Vice President & General Manager, Oracle Financial Services.
Second, with these advanced models, they will have much more information to make things like credit decisions. Third, as they look at the buildup of their credit books, they will have better ways to model all the different scenarios that can happen in the external world, things that could impact their liquidity.
So, if you remember spring of last year, we had several large banks go under. It almost started a banking crisis. Why did that happen? It was not because those banks were not smart. It was because their risk management did not anticipate certain types of risks that were happening. And because they did not anticipate it, they had a run on the liquidity and all of a sudden, they found themselves illiquid at the time. So, as we get better tech and better models working on this, we can work out a lot more scenarios for the lenders so that they are not susceptible.
From a borrower's perspective, I think it will create a much better experience. I live in the US, where if you are filling out a mortgage application to buy a house, it is a very long and elaborate process and it actually is a frustrating process. I have to share information two or three times that I have already provided the bank in other contexts. So, that does not create a great experience for me. Also, the rates or the products are not tailored to me. So, when you reverse that lens that I described from the lender's perspective, all of that drives advantages for the borrower. It gives me much more targeted pricing. It gives me much more targeted products. It gives me a much better experience because technology is enabling all that information to flow seamlessly and the models that are running on that information are helping the bank and borrower with a better interaction.
ET: Data security, regulation, compliance, ethics and competition. A Citi report says AI models are known to hallucinate and create information that does not exist. This can be particularly troublesome in the financial services space. How can AI take that leap forward?
SS:
Well, I mean, there are a lot of things in what you just said. Firstly, let me talk about security and then I will go to regulation. So, in my mind, one of the reasons why Oracle is so differentiated in the world of security is because we have had this notion of autonomous for a very long time.
If you look at the traditional areas where security challenges happen, there are three or four of them. The first thing is human error. Human error is, if you were supposed to do X and you did Y, you created a vulnerability. When you use autonomous technologies where models that have been trained over reams and reams of data, they are far more capable of avoiding those mistakes than humans who have to go through training to do their jobs. So, from our standpoint, AI actually facilitates through our autonomous technologies. It actually prevents security breaches.
There are other reasons for security breaches, things like passwords. Some people will have a password and call it ‘password.’ There are probably like a hundred passwords out there that if you test it out against many systems, you will be able to breach. So, we are creating a lot of visual intelligence and natural language, biometrics, and other things to prevent that security. So, again, technology actually helps in this regard, but you have to implement it properly.
Source – Citi GPS: AI in Finance
The third is data motion. When data is at rest or in motion, people can tap into it on the network, there is network vulnerability. We have spent years, decades, in encryption technology. So, our data is always encrypted. And in fact, our operators in our cloud do not see the data of our customers. They cannot see it. The customers hold the keys to the data, not our operators. Our operators can do the job in the cloud, but they cannot see any of the data.
The fourth is writing bad code. So, as we move to more AI generated code, we are putting a lot of focus on making sure that the code itself is not created with many of the common mistakes that are made in coding that create vulnerabilities.
So, these are all technologies that actually support better security. And it is coming through AI. It is coming through all these investments that we made in things like encryption.
On the regulatory side, you asked that part of the question. I mean, I can tell you that if you ask a CEO what keeps him or her up at night? It is all obvious stuff, shareholder value, and growth, but one thing that they worry a lot about is the reputational damage that comes from financial crime and fraud.
Now think of people who do money laundering. They are not your typical user. They are very advanced technologists. They are not people who are novices at technology. These are state actors, these are very sophisticated cyber criminals who do money laundering, and they have very advanced tools at their disposal and banks struggle a lot to keep up with them. So, in my mind, when you think about compliance, we already have products out there in the market that are enabling detection and investigation. We are also providing AI agents that act like bad actors, so a bank can truly experience what these attacks could look like. So, in my mind, again, AI is a huge transformer in the battle against financial crime.
Yes, there has to be regulatory scrutiny and things can go wrong. I will take the example of your hallucinations that can get created. So, imagine that the AI does not use proper data and rejects a credit application. That is a problem because the bank can be fined for having unfair lending practices. So, it is not that you can just adopt any kind of AI and put it into motion. It has to be put through the paces, it has to be tested extensively. More importantly, you better be training with very large-scale data sets. So, yes, the AI will be scrutinised, data models will have to be transparent, and regulators will scrutinise this and they will continue to increase the scrutiny on this as this evolves. But in my mind, if you look at security, financial crime, regulatory risk, all of these are going to be greatly enhanced with AI.
ET: So, the financial sector is not only big banks. You have a lot of startups. You have a lot of smaller SMBs who are dealing with different types of financial products. Do you see them behaving differently from the more established or the traditional banks and do their needs also differ?
SS:
Yes, most certainly. You are familiar with JPMorgan Chase, one of the largest banks in the US, and perhaps the world. So, Jamie Dimon, in his last letter to the shareholders, mentioned that he has 57,000 IT professionals. You go to a small bank; they have 5,000 people. If you go to a credit union, they probably have 50 people.
So, obviously, how they use technology versus how JPMorgan Chase uses technology are two different things. On one end of the spectrum are the really big banks with sophistication in technology, sophisticated thinking, large IT groups. They will partner with technology partners and they will take parts from them and they will add their own technology — whatever you can call it, secret sauces — on them because they have the wherewithal to do that. And so, they look for technology partners as enablers and augmenters.
When you go to the other end of the spectrum, you have a small credit union or a small community bank. They want you to do everything. They want you to do cash management. They want you to do check printing. They want you to do ATM restocking, including an IT help desk, and everything that comes with their operations. They do not want to be in the business of technology. So, then they want partners who can provide end-to-end services. So, here the technology partner is a full-service provider.
Now, if you take a bank in the middle, like a $100 billion bank, they will do a mix of both. They will take a lot of piece parts, like they might take our ERP systems or our core banking systems, but they might build the channel technology themselves. So, that is the range that you will experience in this regard.
ET: It is often said that technology is going to be a great bridge in the credit gap that exists, especially when it comes to small and medium businesses. What is the role of AI in this? And personally, do you see that happening? It has been talked around for quite some time that the mobile revolution, and technology, would finally bridge the credit gap.
SS:
I think it is in the rear-view mirror. Take, for example, in India you can pay for street food like golgappas with Paytm. What does that do? It allows the person to develop credit, to have a bank account, to have financial data, and this did not happen by accident. You first had to create an identity, which was Aadhaar. You had to create a payment network, which was UPI. You had to create a policy to drive this adoption, to get technology partners to participate. This was a very deliberate exercise. Now, has that created an opportunity for a much broader financial inclusion? Absolutely.
So, I am working with several banks in India and around the globe where financial inclusion is an imperative, and we are providing them capabilities that are financial inclusion oriented.
ET: What do you spend time on now? What does your product pipeline look like and what are the things that you are working on?
SS:
We are very fortunate that we have a very broad suite of capabilities for financial services — everything from our cloud infrastructure, a lot of applications for running the back office, the mid office, and the front office, and very specific applications for the banking industry, product manufacturing for banking, core operations for banking, deposits, loans, all those systems, channel system. And we are working with 2,000 different banks across the globe in more than 100 countries.
Our job is to take all of these capabilities that we have had, modernise that architecture, make it available on the cloud, and infuse it with all the transformational technologies that our customers need. Our customers are running mainframe systems that were built in the 1970s. Many of the customers are still running them for their core operations. Now think about what has happened since then. The internet did not exist for commercial use in the 1970s and 1980s, social technologies did not exist, mobility did not exist, AI was a research paper at that time. So, as these customers need to adopt all of these capabilities, they need to move into modern systems and they have to look to companies like us to bring them those modern systems. Our job is to not only build those systems, but make them successful inside of our customers' environments, and that is what keeps us up at night.
Disclaimer – The author was in Las Vegas on an invitation from Oracle."
